Timestamp,Organization Name,Primary contact email,In which Orange County cities does your organization conduct community outreach? Check all that apply.,In which language(s) does your organization conduct outreach? Check all that apply.,Which of the following race/ethnic group(s) describes the communities that your organization reaches? Check all that apply.,Which of the following demographic characteristic(s) describe the communities that your organization reaches? Check all that apply.,Which of the following outreach activities does your organization conduct to reach communities? Check all that apply.
8/8/2022 15:49,gwc,gwc@ourgoodwork.co,"Brea, Costa Mesa, Huntington Beach, La Palma, Laguna Hills, Rancho Santa Margarita, Tustin","English, Chinese (Mandarin), Japanese, Spanish, Vietnamese","Asian American, Black / African American","Houseless individuals & families, LGBTQ+, Older adults / seniors","Caravan / parade, Door-to-door canvassing, In-person events / gatherings, Food / kit distribution, Mailings, Media (TV, radio, newspapers), Peer-to-peer / mass texting, Phone banking, Tabling / flier distribution, Virtual events / gatherings"
8/8/2022 15:49,Kristin,kristin.chang@ourgoodwork.co,"Cypress, Dana Point, Fountain Valley, Yorba Linda","English, Chinese (Cantonese), Chinese (Mandarin), Korean, Spanish","Latinx, Middle Eastern / North African, Non-Hispanic White","Immigrants / Refugees, Limited English speaking ability, Low broadband subscription rate","In-person events / gatherings, Food / kit distribution, Virtual events / gatherings"
8/8/2022 15:51,Stephanie,stephanie@ourgoodwork.co,"Fountain Valley, Garden Grove, Orange, Placentia, Villa Park, Westminster","English, Russian, Tagalog, punjabi and hindi","Middle Eastern / North African, Native Hawaiian / Pacific Islander, Non-Hispanic White","Children under 5, Farmworker, Houseless individuals & families, Immigrants / Refugees","Door-to-door canvassing, Food / kit distribution, Mailings, Media (TV, radio, newspapers)"
8/8/2022 15:53,Jim,jim.miller@ourgoodwork.co,Mission Viejo,"English, Portuguese",Latinx,"Older adults / seniors, Veterans",Phone banking
8/8/2022 15:54,Aminah,aminah.luqman@ourgoodwork.co,"Dana Point, Santa Ana","English, Tagalog","Native American / Tribal Communities, Native Hawaiian / Pacific Islander","Limited English speaking ability, Low broadband subscription rate","Mailings, Virtual events / gatherings"
8/8/2022 15:55,Emily,emily.chan@ourgoodwork.co,"Fountain Valley, Los Alamitos, Mission Viejo","German, Tamil","Asian American, Non-Hispanic White","Houseless individuals & families, Immigrants / Refugees",Caravan / parade
